_code,ticker,company_name,country,gics_sector,gics_industry_group,gics_industry,last_include,first_include
CNE1000058S0,301236 C2 Equity,Isoftstone Information Technology Group Co Ltd,CH,45,4510,451020,2024-05-31,2023-06-01
CNE0000003P4,600816 C1 Equity,J-Yuan Trust Co Ltd,CH,40,4020,402030,2020-05-31,2018-06-01
CNE100000SD1,002459 C2 Equity,JA Solar Technology Co Ltd,CH,45,4530,453010,2024-05-31,2020-12-01
CNE000001F05,600584 C1 Equity,JCET Group Co Ltd,CH,45,4530,453010,2024-05-31,2021-03-01
KYG5074A1004,6618 HK Equity,JD Health International Inc,CH,30,3010,301010,2024-05-31,2020-12-01
KYG5074S1012,2618 HK Equity,JD Logistics Inc,CH,20,2030,203010,2024-05-31,2023-06-01
US47215P1066,JD UW Equity,JD.com Inc,CH,25,2550,255030,2021-11-30,2015-12-01
KYG8208B1014,9618 HK Equity,JD.com Inc,CH,25,2550,255030,2024-05-31,2021-12-01
CNE100002995,300529 C2 Equity,Jafron Biomedical Co Ltd,CH,35,3510,351010,2023-08-31,2019-12-01
CNE100002GF7,603816 C1 Equity,Jason Furniture Hangzhou Co Ltd,CH,25,2520,252010,2024-05-31,2020-12-01
CNE100002RJ6,601128 C1 Equity,Jiangsu Changshu Rural Commercial Bank Co Ltd,CH,40,4010,401010,2021-11-30,2019-12-01
CNE0000012K6,000301 C2 Equity,Jiangsu Eastern Shenghong Co Ltd,CH,15,1510,151010,2024-05-31,2021-06-01
CNE1000003J5,177 HK Equity,Jiangsu Expressway Co Ltd,CH,20,2030,203050,2024-05-31,2014-03-01
CNE1000019R4,601100 C1 Equity,Jiangsu Hengli Hydraulic Co Ltd,CH,20,2010,201060,2024-05-31,2019-12-01
CNE0000014W7,600276 C1 Equity,Jiangsu Hengrui Pharmaceuticals Co Ltd,CH,35,3520,352020,2024-05-31,2018-06-01
CNE100001TH8,603369 C1 Equity,Jiangsu King's Luck Brewery JSC Ltd,CH,30,3020,302010,2024-05-31,2019-12-01
CNE100000CG8,002262 C2 Equity,Jiangsu Nhwa Pharmaceutical Co Ltd,CH,35,3520,352020,2024-05-31,2023-09-01
CNE100001VC5,603688 C1 Equity,Jiangsu Pacific Quartz Co Ltd,CH,45,4530,453010,2024-05-31,2023-03-01
CNE1000019Q6,601928 C1 Equity,Jiangsu Phoenix Publishing & Media Corp Ltd,CH,50,5020,502010,2024-05-31,2023-09-01
CNE000001P11,002075 C2 Equity,Jiangsu Shagang Co Ltd,CH,15,1510,151040,2021-11-30,2020-06-01
CNE100000HB8,002304 C2 Equity,Jiangsu Yanghe Distillery Co Ltd,CH,30,3020,302010,2024-05-31,2018-06-01
CNE000001B66,600486 C1 Equity,Jiangsu Yangnong Chemical Co Ltd,CH,15,1510,151010,2024-05-31,2019-12-01
CNE100000PG0,002409 C2 Equity,Jiangsu Yoke Technology Co Ltd,CH,15,1510,151010,2024-05-31,2021-06-01
CNE1000009X3,002223 C2 Equity,Jiangsu Yuyue Medical Equipment & Supply Co Ltd,CH,35,3510,351010,2024-05-31,2019-12-01
CNE0000011P7,000961 C2 Equity,Jiangsu Zhongnan Construction Group Co Ltd,CH,60,6020,602010,2021-11-30,2019-12-01
CNE000001CW4,600522 C1 Equity,Jiangsu Zhongtian Technology Co Ltd,CH,20,2010,201040,2024-05-31,2019-12-01
CNE0000019P0,600362 C1 Equity,Jiangxi Copper Co Ltd,CH,15,1510,151040,2024-05-31,2018-06-01
CNE1000003K3,358 HK Equity,Jiangxi Copper Co Ltd,CH,15,1510,151040,2024-05-31,2014-03-01
CNE1000007F4,002176 C2 Equity,Jiangxi Special Electric Motor Co Ltd,CH,20,2010,201040,2024-05-31,2022-06-01
CNE1000006H2,002157 C2 Equity,Jiangxi Zhengbang Technology Co Ltd,CH,30,3020,302020,2022-11-30,2019-12-01
CNE100000SK6,601718 C1 Equity,Jihua Group Corp Ltd,CH,20,2020,202010,2018-11-30,2018-06-01
CNE000000719,000623 C2 Equity,Jilin Aodong Pharmaceutical Group Co Ltd,CH,35,3520,352020,2021-11-30,2019-12-01
CNE1000009Y1,601958 C1 Equity,Jinduicheng Molybdenum Co Ltd,CH,15,1510,151040,2024-05-31,2018-06-01
CNE000000073,000656 C2 Equity,Jinke Properties Group Co Ltd,CH,60,6020,602010,2022-11-30,2018-06-01
CNE100005R96,688223 C1 Equity,Jinko Solar Co Ltd,CH,45,4530,453010,2024-05-31,2023-06-01
KYG5140J1013,1951 HK Equity,Jinxin Fertility Group Ltd,CH,35,3510,351020,2022-11-30,2020-12-01
CNE000000Y37,600201 C1 Equity,Jinyu Bio-Technology Co Ltd,CH,35,3520,352010,2021-05-31,2019-12-01
CNE000000S92,000799 C2 Equity,JiuGui Liquor Co Ltd,CH,30,3020,302010,2024-05-31,2020-12-01
KYG5141L1059,9922 HK Equity,Jiumaojiu International Holdings Ltd,CH,25,2530,253010,2023-11-30,2021-03-01
CNE0000010H6,000937 C2 Equity,Jizhong Energy Resources Co Ltd,CH,10,1010,101020,2024-05-31,2022-06-01
CNE000001816,600380 C1 Equity,Joincare Pharmaceutical Group Industry Co Ltd,CH,35,3520,352020,2024-05-31,2019-12-01
CNE100002W27,603127 C1 Equity,Joinn Laboratories China Co Ltd,CH,35,3520,352030,2023-08-31,2021-06-01
CNE100000W45,600998 C1 Equity,Jointown Pharmaceutical Group Co Ltd,CH,35,3510,351020,2024-05-31,2018-06-01
CNE000000HK0,600872 C1 Equity,Jonjee Hi-Tech Industrial And Commercial Holding Co Ltd,CH,30,3020,302020,2024-05-31,2019-12-01
CNE100000BQ9,002242 C2 Equity,Joyoung Co Ltd,CH,25,2520,252010,2021-11-30,2020-06-01
CNE100002RT5,603517 C1 Equity,Juewei Food Co Ltd,CH,30,3020,302020,2024-02-29,2019-12-01
CNE100001ZY0,603885 C1 Equity,Juneyao Airlines Co Ltd,CH,20,2030,203020,2024-05-31,2019-12-01
US4824971042,BEKE UN Equity,KE Holdings Inc,CH,60,6020,602010,2024-05-31,2020-09-01
KYG532241042,1813 HK Equity,KWG Group Holdings Ltd,CH,60,6020,602010,2022-05-31,2018-06-01
KYG521321003,1638 HK Equity,Kaisa Group Holdings Ltd,CH,60,6020,602010,2021-11-30,2018-06-01
CNE0000017M1,600518 C1 Equity,Kangmei Pharmaceutical Co Ltd,CH,35,3520,352020,2019-05-31,2018-06-01
US48553T1060,BZ UW Equity,Kanzhun Ltd,CH,50,5020,502030,2024-05-31,2021-12-01
CNE000001CP8,600499 C1 Equity,Keda Industrial Group Co Ltd,CH,20,2010,201060,2024-05-31,2022-06-01
KYG525681477,268 HK Equity,Kingdee International Software Group Co Ltd,CH,45,4510,451030,2024-05-31,2018-06-01
CNE000001JP3,600143 C1 Equity,Kingfa Sci & Tech Co Ltd,CH,15,1510,151010,2022-11-30,2020-12-01
CNE100000XB5,002517 C2 Equity,Kingnet Network Co Ltd,CH,50,5020,502020,2024-05-31,2023-09-01
US49639K1016,KC UW Equity,Kingsoft Cloud Holdings Ltd,CH,45,4510,451020,2022-05-31,2020-12-01
KYG5264Y1089,3888 HK Equity,Kingsoft Corp Ltd,CH,50,5020,502020,2024-05-31,2014-06-01
KYG532631028,1024 HK Equity,Kuaishou Technology,CH,50,5020,502030,2024-05-31,2021-03-01
CNE1000018P0,002625 C2 Equity,Kuang-Chi Technologies Co Ltd,CH,20,2010,201010,2024-05-31,2020-12-01
CNE100001YF2,300418 C2 Equity,Kunlun Tech Co Ltd,CH,50,5020,502020,2024-05-31,2020-06-01
CNE0000018R8,600519 C1 Equity,Kweichow Moutai Co Ltd,CH,30,3020,302010,2024-05-31,2018-06-01
CNE1000015M3,002601 C2 Equity,LB Group Co Ltd,CH,15,1510,151010,2024-05-31,2019-12-01
CNE100001FR6,601012 C1 Equity,LONGi Green Energy Technology Co Ltd,CH,45,4530,453010,2024-05-31,2018-06-01
CNE100003KF7,300773 C2 Equity,Lakala Payment Co Ltd,CH,40,4020,402010,2022-05-31,2020-12-01
CNE1000023Q8,603883 C1 Equity,Laobaixing Pharmacy Chain JSC,CH,30,3010,301010,2022-05-31,2019-12-01
CNE100001ZT0,3396 HK Equity,Legend Holdings Corp,CH,45,4520,452020,2020-11-30,2018-06-01
HK0992009065,992 HK Equity,Lenovo Group Ltd,CH,45,4520,452020,2024-05-31,2014-03-01
CNE100001YW7,300433 C2 Equity,Lens Technology Co Ltd,CH,45,4520,452030,2024-05-31,2019-06-01
CNE1000000F9,002131 C2 Equity,Leo Group Co Ltd,CH,50,5020,502010,2021-11-30,2020-06-01
CNE100000H44,300003 C2 Equity,Lepu Medical Technology Beijing Co Ltd,CH,35,3510,351010,2024-05-31,2019-06-01
CNE100001CB7,300296 C2 Equity,Leyard Optoelectronic Co Ltd,CH,45,4520,452030,2022-05-31,2019-12-01
US50202M1027,LI UW Equity,Li Auto Inc,CH,25,2510,251020,2022-11-30,2021-03-01
KYG5479M1050,2015 HK Equity,Li Auto Inc,CH,25,2510,251020,2024-05-31,2022-12-01
KYG5496K1242,2331 HK Equity,Li Ning Co Ltd,CH,25,2520,252030,2024-05-31,2019-06-01
CNE000000LY3,600739 C1 Equity,Liaoning Cheng Da Co Ltd,CH,25,2550,255010,2021-11-30,2018-06-01
CNE100000X77,601880 C1 Equity,Liaoning Port Co Ltd,CH,20,2030,203050,2024-05-31,2019-12-01
CNE1000015L5,002600 C2 Equity,Lingyi iTech Guangdong Co,CH,45,4520,452030,2024-05-31,2019-12-01
CNE0000002Y8,000513 C2 Equity,Livzon Pharmaceutical Group Inc,CH,35,3520,352020,2024-05-31,2019-12-01
KYG555551095,3380 HK Equity,Logan Group Co Ltd,CH,60,6020,602010,2022-08-31,2018-06-01
KYG5635P1090,960 HK Equity,Longfor Group Holdings Ltd,CH,60,6020,602010,2024-05-31,2014-03-01
US54951L1098,LKNCY UW Equity,Luckin Coffee Inc,CH,25,2530,253010,2020-05-31,2020-03-01
CNE000000Y94,600167 C1 Equity,Luenmei Quantum Co Ltd,CH,55,5510,551040,2021-05-31,2020-06-01
US54975P2011,LU UN Equity,Lufax Holding Ltd,CH,40,4020,402020,2024-02-29,2020-12-01
CNE100004116,300850 C2 Equity,Luoyang Xinqianglian Slewing Bearing Co Ltd,CH,20,2010,201060,2023-05-31,2021-12-01
CNE000000WN3,000830 C2 Equity,Luxi Chemical Group Co Ltd,CH,15,1510,151010,2024-02-29,2019-12-01
CNE100000TP3,002475 C2 Equity,Luxshare Precision Industry Co Ltd,CH,45,4520,452030,2024-05-31,2018-06-01
BMG570071099,2186 HK Equity,Luye Pharma Group Ltd,CH,35,3520,352020,2021-02-28,2015-06-01
CNE000000GF2,000568 C2 Equity,Luzhou Laojiao Co Ltd,CH,30,3020,302010,2024-05-31,2018-06-01
CNE100005PC8,688114 C1 Equity,MGI Tech Co Ltd,CH,35,3520,352030,2024-05-31,2024-03-01
US66981J1025,MNSO UN Equity,MINISO Group Holding Ltd,CH,25,2550,255030,2023-11-30,2023-03-01
KYG6180F1081,9896 HK Equity,MINISO Group Holding Ltd,CH,25,2550,255030,2024-05-31,2023-12-01
CNE1000003R8,323 HK Equity,Maanshan Iron & Steel Co Ltd,CH,15,1510,151040,2020-05-31,2018-12-01
CNE000000DD4,600808 C1 Equity,Maanshan Iron & Steel Co Ltd,CH,15,1510,151040,2022-11-30,2018-06-01
CNE1000020H3,300463 C2 Equity,Maccura Biotechnology Co Ltd,CH,35,3520,352030,2021-11-30,2020-12-01
CNE100001Y83,300413 C2 Equity,Mango Excellent Media Co Ltd,CH,50,5020,502020,2024-05-31,2019-06-01
CNE100003QK4,300782 C2 Equity,Maxscend Microelectronics Co Ltd,CH,45,4520,452030,2024-05-31,2020-09-01
CNE000000HP9,600873 C1 Equity,Meihua Holdings Group Co Ltd,CH,30,3020,302020,2024-05-31,2023-03-01
CNE000001LV7,002044 C2 Equity,Meinian Onehealth Healthcare Holdings Co Ltd,CH,35,3510,351020,2024-05-31,2018-06-01
KYG5966D1051,1357 HK Equity,Meitu Inc,CH,50,5020,502030,2019-11-30,2017-12-01
KYG596691041,3690 HK Equity,Meituan,CH,25,2530,253010,2024-05-31,2019-03-01
CNE100000FF3,1618 HK Equity,Metallurgical Corp of China Ltd,CH,20,2010,201030,2020-05-31,2018-06-01
CNE100000FX6,601618 C1 Equity,Metallurgical Corp of China Ltd,CH,20,2010,201030,2024-05-31,2018-06-01
KYG608371046,853 HK Equity,Microport Scientific Corp,CH,35,3510,351010,2024-02-29,2020-09-01
CNE100001QQ5,000333 C2 Equity,Midea Group Co Ltd,CH,25,2520,252010,2024-05-31,2018-06-01
CNE100003HQ0,601615 C1 Equity,Ming Yang Smart Energy Group Ltd,CH,20,2010,201040,2024-05-31,2021-06-01
KYG6142R1092,909 HK Equity,Ming Yuan Cloud Group Holdings Ltd,CH,45,4510,451030,2022-11-30,2021-03-01
KYG6145U1094,425 HK Equity,Minth Group Ltd,CH,25,2510,251010,2024-02-29,2017-06-01
CNE100003MN7,688008 C1 Equity,Montage Technology Co Ltd,CH,45,4530,453010,2024-05-31,2021-06-01
CNE100001RQ3,002714 C2 Equity,Muyuan Foods Co Ltd,CH,30,3020,302020,2024-05-31,2018-06-01
CNE000001G38,600406 C1 Equity,NARI Technology Co Ltd,CH,20,2010,201040,2024-05-31,2018-09-01
CNE100000ML7,002371 C2 Equity,NAURA Technology Group Co Ltd,CH,45,4530,453010,2024-05-31,2019-12-01
US62914V1061,NIO UN Equity,NIO Inc,CH,25,2510,251020,2024-05-31,2019-06-01
CNE100000080,002127 C2 Equity,NanJi E-Commerce Co Ltd,CH,50,5020,502010,2021-11-30,2019-12-01
CNE0000014Q9,600282 C1 Equity,Nanjing Iron & Steel Co Ltd,CH,15,1510,151040,2020-05-31,2019-12-01
CNE100002WP3,603707 C1 Equity,Nanjing King-Friend Biochemical Pharmaceutical Co Ltd,CH,35,3520,352020,2024-05-31,2019-12-01
CNE1000031R9,601990 C1 Equity,Nanjing Securities Co Ltd,CH,40,4020,402030,2024-05-31,2019-12-01
CNE1000040F5,688126 C1 Equity,National Silicon Industry Group Co Ltd,CH,45,4530,453010,2024-05-31,2021-09-01
CNE100000P69,002405 C2 Equity,NavInfo Co Ltd,CH,45,4510,451030,2024-02-29,2019-12-01
US64110W1027,NTES UW Equity,NetEase Inc,CH,50,5020,502020,2021-11-30,2015-12-01
KYG6427A1022,9999 HK Equity,NetEase Inc,CH,50,5020,502020,2024-05-31,2021-12-01
CNE100001922,1336 HK Equity,New China Life Insurance Co Ltd,CH,40,4030,403010,2024-05-31,2014-03-01
CNE1000019Y0,601336 C1 Equity,New China Life Insurance Co Ltd,CH,40,4030,403010,2024-05-31,2018-06-01
CNE000000VB0,000876 C2 Equity,New Hope Liuhe Co Ltd,CH,30,3020,302020,2024-05-31,2018-06-01
US6475812060,EDU UN Equity,New Oriental Education & Technology Group Inc,CH,25,2530,253020,2022-05-31,2015-12-01
KYG6470A1168,9901 HK Equity,New Oriental Education & Technology Group Inc,CH,25,2530,253020,2024-05-31,2022-06-01
CNE0000014B1,000997 C2 Equity,Newland Digital Technology Co Ltd,CH,45,4510,451030,2020-11-30,2019-12-01
CNE1000007W9,002180 C2 Equity,Ninestar Corp,CH,45,4520,452020,2024-05-31,2018-06-01
CNE1000052S3,605117 C1 Equity,Ningbo Deye Technology Co Ltd,CH,20,2010,201060,2024-05-31,2022-06-01
CNE000000DJ1,600699 C1 Equity,Ningbo Joyson Electronic Corp,CH,25,2510,251010,2024-05-31,2019-12-01
CNE100001T23,603606 C1 Equity,Ningbo Orient Wires & Cables Co Ltd,CH,20,2010,201040,2024-05-31,2022-06-01
CNE100003MS6,688005 C1 Equity,Ningbo Ronbay New Energy Technology Co Ltd,CH,20,2010,201040,2024-02-29,2022-03-01
CNE100001567,601567 C1 Equity,Ningbo Sanxing Medical Electric Co Ltd,CH,20,2010,201040,2024-05-31,2024-03-01
CNE000000JJ8,600884 C1 Equity,Ningbo Shanshan Co Ltd,CH,15,1510,151010,2024-05-31,2022-03-01
CNE1000023J3,601689 C1 Equity,Ningbo Tuopu Group Co Ltd,CH,25,2510,251010,2024-05-31,2020-06-01
CNE100000V12,601018 C1 Equity,Ningbo Zhoushan Port Co Ltd,CH,20,2030,203050,2020-08-31,2018-06-01
CNE100003LF5,600989 C1 Equity,Ningxia Baofeng Energy Group Co Ltd,CH,15,1510,151010,2024-05-31,2021-06-01
US65487X1028,NOAH UN Equity,Noah Holdings Ltd,CH,40,4020,402030,2022-05-31,2018-06-01
CNE100004272,9633 HK Equity,Nongfu Spring Co Ltd,CH,30,3020,302010,2024-05-31,2021-03-01
CNE000000198,000519 C2 Equity,North Industries Group Red Arrow Co Ltd,CH,20,2010,201060,2024-02-29,2021-12-01
CNE0000004H9,000686 C2 Equity,Northeast Securities Co Ltd,CH,40,4020,402030,2022-11-30,2019-12-01
CNE100000S33,002456 C2 Equity,OFILM Group Co Ltd,CH,45,4520,452030,2024-05-31,2018-06-01
CNE000000123,000046 C2 Equity,Oceanwide Holdings Co Ltd,CH,40,4020,402010,2021-05-31,2019-06-01
CNE100001641,002607 C2 Equity,Offcn Education Technology Co Ltd,CH,25,2530,253020,2024-05-31,2020-06-01
CNE0000019T2,600583 C1 Equity,Offshore Oil Engineering Co Ltd,CH,10,1010,101010,2024-05-31,2018-06-01
US68248T2042,OCFT UN Equity,OneConnect Financial Technology Co Ltd,CH,45,4510,451030,2021-11-30,2021-06-01
CNE100002RB3,603833 C1 Equity,Oppein Home Group Inc,CH,25,2520,252010,2024-05-31,2018-12-01
CNE100001ZV6,600958 C1 Equity,Orient Securities Co Ltd/China,CH,40,4020,402030,2024-05-31,2018-06-01
CNE0000004Z1,600637 C1 Equity,Oriental Pearl Group Co Ltd,CH,50,5020,502010,2024-05-31,2018-06-01
CNE100002MR0,300595 C2 Equity,Ovctek China Inc,CH,35,3510,351010,2024-02-29,2019-12-01
CNE100000593,2328 HK Equity,PICC Property & Casualty Co Ltd,CH,40,4030,403010,2024-05-31,2014-03-01
CNE1000008V9,601099 C1 Equity,Pacific Securities Co Ltd/The/China,CH,40,4020,402030,2021-11-30,2019-12-01
CNE0000007H2,000629 C2 Equity,Pangang Group Vanadium Titanium & Resources Co Ltd,CH,15,1510,151040,2024-05-31,2019-12-01
CNE100001MK7,1339 HK Equity,People's Insurance Co Group of China Ltd/The,CH,40,4030,403010,2024-05-31,2014-03-01
CNE100003F27,601319 C1 Equity,People's Insurance Co Group of China Ltd/The,CH,40,4030,403010,2024-05-31,2020-03-01
CNE100001FP0,603000 C1 Equity,People.cn Co Ltd,CH,50,5020,502010,2024-05-31,2023-09-01
CNE1000018W6,002624 C2 Equity,Perfect World Co Ltd/China,CH,50,5020,502020,2024-05-31,2018-06-01
CNE1000003W8,857 HK Equity,PetroChina Co Ltd,CH,10,1010,101020,2024-05-31,2014-03-01
CNE1000007Q1,601857 C1 Equity,PetroChina Co Ltd,CH,10,1010,101020,2024-05-31,2018-06-01
CNE1000035K5,300725 C2 Equity,PharmaBlock Sciences Nanjing Inc,CH,35,3520,352020,2022-05-31,2021-12-01
CNE100003PG4,3759 HK Equity,Pharmaron Beijing Co Ltd,CH,35,3520,352030,2023-08-31,2020-12-01
CNE100003JW4,300759 C2 Equity,Pharmaron Beijing Co Ltd,CH,35,3520,352030,2024-05-31,2021-06-01
CNE000000040,000001 C2 Equity,Ping An Bank Co Ltd,CH,40,4010,401010,2024-05-31,2018-06-01
KYG711391022,1833 HK Equity,Ping An Healthcare and Technology Co Ltd,CH,30,3010,301010,2024-02-29,2019-12-01
CNE000001R84,601318 C1 Equity,Ping An Insurance Group Co of China Ltd,CH,40,4030,403010,2024-05-31,2018-06-01
CNE1000003X6,2318 HK Equity,Ping An Insurance Group Co of China Ltd,CH,40,4030,403010,2024-05-31,2014-03-01
CNE000001PH7,601666 C1 Equity,Pingdingshan Tianan Coal Mining Co Ltd,CH,10,1010,101020,2023-08-31,2022-06-01
CNE100005998,688072 C1 Equity,Piotech Inc,CH,45,4530,453010,2024-05-31,2023-09-01
CNE000001ND1,600048 C1 Equity,Poly Developments and Holdings Group Co Ltd,CH,60,6020,602010,2024-05-31,2018-06-01
CNE100003PV3,6049 HK Equity,Poly Property Services Co Ltd,CH,60,6020,602010,2021-11-30,2020-06-01
KYG7170M1033,9992 HK Equity,Pop Mart International Group Ltd,CH,25,2550,255040,2024-05-31,2022-06-01
CNE100001S57,300363 C2 Equity,Porton Pharma Solutions Ltd,CH,35,3520,352020,2023-08-31,2022-12-01
CNE1000029W3,1658 HK Equity,Postal Savings Bank of China Co Ltd,CH,40,4010,401010,2024-05-31,2018-06-01
CNE100003PZ4,601658 C1 Equity,Postal Savings Bank of China Co Ltd,CH,40,4010,401010,2024-05-31,2020-09-01
CNE1000017G1,601669 C1 Equity,Power Construction Corp of China Ltd,CH,20,2010,201030,2024-05-31,2018-06-01
KYG720051047,1238 HK Equity,Powerlong Real Estate Holdings Ltd,CH,60,6020,602010,2022-05-31,2021-06-01
CNE100002TP9,603605 C1 Equity,Proya Cosmetics Co Ltd,CH,30,3030,303020,2023-05-31,2020-06-01
CNE100005D68,688063 C1 Equity,Pylon Technologies Co Ltd,CH,20,2010,201040,2024-02-29,2022-09-01
CNE1000041K3,688561 C1 Equity,Qi An Xin Technology Group Inc,CH,45,4510,451030,2024-05-31,2023-06-01
CNE1000026G2,603027 C1 Equity,Qianhe Condiment and Food Co Ltd,CH,30,3020,302020,2021-11-30,2020-12-01
US88557W1018,QFIN UW Equity,Qifu Technology Inc,CH,40,4020,402020,2024-05-31,2021-06-01
US74734M1099,QIHU UN Equity,Qihoo 360 Technology Co Ltd,CH,50,5020,502030,2016-08-31,2015-12-01
CNE100003JQ6,002958 C2 Equity,Qingdao Rural Commercial Bank Corp,CH,40,4010,401010,2022-11-30,2020-06-01
CNE000000SW2,000792 C2 Equity,Qinghai Salt Lake Industry Co Ltd,CH,15,1510,151010,2024-05-31,2018-06-01
US7477981069,QD UN Equity,Qudian Inc,CH,40,4020,402020,2020-02-29,2019-12-01
US74969N1037,RLX UN Equity,RLX Technology Inc,CH,30,3020,302030,2022-11-30,2021-03-01
CNE100001Z58,300442 C2 Equity,Range Intelligent Computing Technology Group Co Ltd,CH,45,4510,451020,2024-05-31,2023-12-01
CNE100003MX6,688002 C1 Equity,Raytron Technology Co Ltd,CH,45,4520,452030,2024-02-29,2021-06-01
CNE1000005Y9,002146 C2 Equity,RiseSun Real Estate Development Co Ltd,CH,60,6020,602010,2022-05-31,2018-06-01
CNE100000T73,300118 C2 Equity,Risen Energy Co Ltd,CH,45,4530,453010,2024-05-31,2023-03-01
CNE100003J15,603218 C1 Equity,Riyue Heavy Industry Co Ltd,CH,20,2010,201060,2023-11-30,2021-06-01
CNE100003RK2,603893 C1 Equity,Rockchip Electronics Co Ltd,CH,45,4530,453010,2024-05-31,2023-06-01
CNE100000W60,002493 C2 Equity,Rongsheng Petrochemical Co Ltd,CH,15,1510,151010,2024-05-31,2018-06-01
CNE000000TY6,600104 C1 Equity,SAIC Motor Corp Ltd,CH,25,2510,251020,2024-05-31,2018-06-01
CNE000000Q11,600061 C1 Equity,SDIC Capital Co Ltd,CH,40,4020,402030,2024-05-31,2018-06-01
CNE000000JM2,600886 C1 Equity,SDIC Power Holdings Co Ltd,CH,55,5510,551050,2024-05-31,2018-06-01
CNE100000L63,002352 C2 Equity,SF Holding Co Ltd,CH,20,2030,203010,2024-05-31,2018-12-01
CNE100002NT4,300661 C2 Equity,SG Micro Corp,CH,45,4530,453010,2024-05-31,2020-06-01
KYG814771047,SINA UW Equity,SINA Corp/China,CH,50,5020,502030,2021-02-28,2016-12-01
KYG826001003,410 HK Equity,SOHO China Ltd,CH,60,6020,602010,2020-11-30,2014-03-01
CNE100000T99,002468 C2 Equity,STO Express Co Ltd,CH,20,2030,203010,2021-05-31,2020-06-01
CNE100005D92,688777 C1 Equity,SUPCON Technology Co Ltd,CH,45,4520,452030,2024-05-31,2022-12-01
CNE1000015F7,601058 C1 Equity,Sailun Group Co Ltd,CH,25,2510,251010,2024-05-31,2021-06-01
CNE000000KB3,600703 C1 Equity,Sanan Optoelectronics Co Ltd,CH,45,4530,453010,2024-05-31,2018-06-01
CNE1000033T1,300454 C2 Equity,Sangfor Technologies Inc,CH,45,4510,451030,2024-05-31,2019-12-01
CNE1000009J2,002216 C2 Equity,Sanquan Food Co Ltd,CH,30,3020,302020,2021-05-31,2020-12-01
CNE000001QF9,002110 C2 Equity,Sansteel Minguang Co Ltd Fujian,CH,15,1510,151040,2020-11-30,2019-12-01
KYG781631059,631 HK Equity,Sany Heavy Equipment International Holdings Co Ltd,CH,20,2010,201060,2024-05-31,2021-06-01
CNE000001F70,600031 C1 Equity,Sany Heavy Industry Co Ltd,CH,20,2010,201060,2024-05-31,2018-06-01
CNE100001B07,002648 C2 Equity,Satellite Chemical Co Ltd,CH,15,1510,151010,2024-05-31,2021-06-01
CNE0000008K4,000750 C2 Equity,Sealand Securities Co Ltd,CH,40,4020,402030,2023-05-31,2019-12-01
KYG7956A1094,1030 HK Equity,Seazen Group Ltd,CH,60,6020,602010,2022-11-30,2018-06-01
CNE100002BF8,601155 C1 Equity,Seazen Holdings Co Ltd,CH,60,6020,602010,2024-05-31,2018-06-01
KYG8020E1199,981 HK Equity,Semiconductor Manufacturing International Corp,CH,45,4530,453010,2021-02-28,2014-12-01
CNE1000028B9,601127 C1 Equity,Seres Group Co Ltd,CH,25,2510,251020,2024-05-31,2023-06-01
CNE100001T64,601225 C1 Equity,Shaanxi Coal Industry Co Ltd,CH,10,1010,101020,2024-05-31,2018-06-01
CNE000001FP1,600348 C1 Equity,Shan Xi Hua Yang Group New Energy Co Ltd,CH,10,1010,101020,2024-05-31,2022-06-01
CNE100002FV6,603858 C1 Equity,Shandong Buchang Pharmaceuticals Co Ltd,CH,35,3520,352020,2024-02-29,2018-06-01
CNE000001FR7,600547 C1 Equity,Shandong Gold Mining Co Ltd,CH,15,1510,151040,2024-05-31,2018-06-01
CNE1000036N7,1787 HK Equity,Shandong Gold Mining Co Ltd,CH,15,1510,151040,2024-05-31,2020-12-01
CNE1000014X3,002595 C2 Equity,Shandong Himile Mechanical Science & Technology Co Ltd,CH,20,2010,201060,2024-05-31,2023-09-01
CNE000001BM7,600426 C1 Equity,Shandong Hualu Hengsheng Chemical Co Ltd,CH,15,1510,151010,2024-05-31,2019-12-01
CNE100002GM3,601966 C1 Equity,Shandong Linglong Tyre Co Ltd,CH,25,2510,251010,2024-05-31,2018-09-01
CNE000001139,600219 C1 Equity,Shandong Nanshan Aluminum Co Ltd,CH,15,1510,151040,2024-05-31,2019-12-01
CNE000001BG9,600529 C1 Equity,Shandong Pharmaceutical Glass Co Ltd,CH,35,3510,351010,2021-11-30,2020-12-01
CNE100001FB0,300285 C2 Equity,Shandong Sinocera Functional Material Co Ltd,CH,15,1510,151010,2021-08-31,2019-12-01
CNE000001P52,002078 C2 Equity,Shandong Sun Paper Industry JSC Ltd,CH,15,1510,151050,2024-05-31,2019-12-01
CNE100004NC6,301035 C2 Equity,Shandong Weifang Rainbow Chemical Co Ltd,CH,15,1510,151010,2023-05-31,2022-12-01
CNE100000171,1066 HK Equity,Shandong Weigao Group Medical Polymer Co Ltd,CH,35,3510,351010,2024-05-31,2014-03-01
CNE000000NJ0,600777 C1 Equity,Shandong Xinchao Energy Corp Ltd,CH,10,1010,101020,2020-05-31,2019-12-01
CNE0000008S7,600643 C1 Equity,Shanghai AJ Group Co Ltd,CH,40,4020,402010,2020-05-31,2019-12-01
CNE000000LN6,600732 C1 Equity,Shanghai Aiko Solar Energy Co Ltd,CH,45,4530,453010,2024-05-31,2023-03-01
CNE100003LY6,688188 C1 Equity,Shanghai BOCHU Electronic Technology Corp Ltd,CH,45,4520,452030,2024-05-31,2021-12-01
CNE000000CB0,600827 C1 Equity,Shanghai Bailian Group Co Ltd,CH,30,3010,301010,2021-11-30,2021-06-01
CNE1000011K6,002568 C2 Equity,Shanghai Bairun Investment Holding Group Co Ltd,CH,30,3020,302010,2024-05-31,2020-12-01
CNE000000C66,600845 C1 Equity,Shanghai Baosight Software Co Ltd,CH,45,4510,451030,2024-05-31,2019-12-01
CNE000000GG0,900926 CG Equity,Shanghai Baosight Software Co Ltd,CH,45,4510,451030,2024-05-31,2021-12-01
CNE000000WR4,600170 C1 Equity,Shanghai Construction Group Co Ltd,CH,20,2010,201030,2024-05-31,2019-09-01
CNE100000437,2727 HK Equity,Shanghai Electric Group Co Ltd,CH,20,2010,201040,2020-11-30,2014-03-01
CNE100000D55,601727 C1 Equity,Shanghai Electric Group Co Ltd,CH,20,2010,201040,2024-05-31,2018-06-01
CNE000001G53,600021 C1 Equity,Shanghai Electric Power Co Ltd,CH,55,5510,551050,2024-05-31,2019-12-01
CNE000000X38,600196 C1 Equity,Shanghai Fosun Pharmaceutical Group Co Ltd,CH,35,3520,352020,2024-05-31,2018-06-01
CNE100001M79,2196 HK Equity,Shanghai Fosun Pharmaceutical Group Co Ltd,CH,35,3520,352020,2024-05-31,2014-06-01
CNE100000510,1385 HK Equity,Shanghai Fudan Microelectronics Group Co Ltd,CH,45,4530,453010,2023-08-31,2022-12-01
CNE100004PL2,688385 C1 Equity,Shanghai Fudan Microelectronics Group Co Ltd,CH,45,4530,453010,2024-02-29,2022-12-01
CNE000000V89,600009 C1 Equity,Shanghai International Airport Co Ltd,CH,20,2030,203050,2024-05-31,2018-06-01
CNE0000013N8,600018 C1 Equity,Shanghai International Port Group Co Ltd,CH,20,2030,203050,2024-05-31,2018-06-01
CNE0000017K5,600315 C1 Equity,Shanghai Jahwa United Co Ltd,CH,30,3030,303020,2022-05-31,2019-12-01
CNE000000MK0,600754 C1 Equity,Shanghai Jinjiang International Hotels Co Ltd,CH,25,2530,253010,2024-05-31,2019-12-01
CNE1000041Z1,688180 C1 Equity,Shanghai Junshi Biosciences Co Ltd,CH,35,3520,352010,2024-05-31,2021-12-01
CNE000000C74,600848 C1 Equity,Shanghai Lingang Holdings Corp Ltd,CH,60,6020,602010,2024-05-31,2020-12-01
CNE000000HH6,900932 CG Equity,Shanghai Lujiazui Finance & Trade Zone Development Co Ltd,CH,60,6020,602010,2023-08-31,2015-12-01
CNE100001V60,603899 C1 Equity,Shanghai M&G Stationery Inc,CH,20,2020,202010,2024-05-31,2019-12-01
CNE000000B91,600835 C1 Equity,Shanghai Mechanical and Electrical Industry Co Ltd,CH,20,2010,201060,2020-05-31,2019-12-01
CNE100003NQ8,688202 C1 Equity,Shanghai Medicilon Inc,CH,35,3520,352030,2023-05-31,2021-12-01
CNE100002RN8,603728 C1 Equity,Shanghai Moons' Electric Co Ltd,CH,20,2010,201040,2024-05-31,2023-09-01
CNE000000C82,601607 C1 Equity,Shanghai Pharmaceuticals Holding Co Ltd,CH,35,3510,351020,2024-05-31,2018-06-01
CNE1000012B3,2607 HK Equity,Shanghai Pharmaceuticals Holding Co Ltd,CH,35,3510,351020,2024-05-31,2014-03-01
CNE0000011B7,600000 C1 Equity,Shanghai Pudong Development Bank Co Ltd,CH,40,4010,401010,2024-05-31,2018-06-01
CNE100002TX3,603659 C1 Equity,Shanghai Putailai New Energy Technology Co Ltd,CH,15,1510,151010,2024-05-31,2020-06-01
CNE100000C31,002252 C2 Equity,Shanghai RAAS Blood Products Co Ltd,CH,35,3520,352010,2024-05-31,2020-03-01
