_code,ticker,company_name,country,gics_sector,gics_industry_group,gics_industry,last_include,first_include
CNE100002RZ2,601360 C1 Equity,360 Security Technology Inc,CH,45,4510,451030,2024-05-31,2018-12-01
CNE1000010N2,002555 C2 Equity,37 Interactive Entertainment Network Technology Group Co Ltd,CH,50,5020,502020,2024-05-31,2018-06-01
KYG8875G1029,1530 HK Equity,3SBio Inc,CH,35,3520,352010,2024-02-29,2016-06-01
CNE1000042T2,688536 C1 Equity,3peak Inc,CH,45,4530,453010,2024-02-29,2022-12-01
US3168271043,JOBS UW Equity,51job Inc,CH,20,2020,202020,2022-05-31,2018-06-01
US31680Q1040,WUBA UN Equity,58.com Inc,CH,50,5020,502030,2020-08-31,2015-12-01
CNE100002RY5,3319 HK Equity,A-Living Smart City Services Co Ltd,CH,60,6020,602010,2022-11-30,2019-12-01
KYG2953R1149,2018 HK Equity,AAC Technologies Holdings Inc,CH,45,4520,452030,2024-05-31,2014-03-01
CNE100004ZD8,688082 C1 Equity,ACM Research Shanghai Inc,CH,45,4530,453010,2024-05-31,2023-12-01
CNE000000RM5,000738 C2 Equity,AECC Aero-Engine Control Co Ltd,CH,20,2010,201010,2024-05-31,2019-12-01
CNE000000JW1,600893 C1 Equity,AECC Aviation Power Co Ltd,CH,20,2010,201010,2024-05-31,2018-06-01
CNE1000051B1,603529 C1 Equity,AIMA Technology Group Co Ltd,CH,25,2510,251020,2024-05-31,2023-06-01
KYG020141019,1789 HK Equity,AK Medical Holdings Ltd,CH,35,3510,351010,2021-05-31,2020-06-01
KYG040111059,2020 HK Equity,ANTA Sports Products Ltd,CH,25,2520,252030,2024-05-31,2014-03-01
CNE100005RF7,688220 C1 Equity,ASR Microelectronics Co Ltd,CH,45,4530,453010,2024-05-31,2023-06-01
CNE0000018C0,600372 C1 Equity,AVIC Airborne Systems Co Ltd,CH,20,2010,201010,2021-08-31,2018-06-01
CNE000001JY5,002013 C2 Equity,AVIC Electromechanical Systems Co Ltd,CH,20,2010,201010,2023-02-28,2019-12-01
CNE000000KC1,600705 C1 Equity,AVIC Industry-Finance Holdings Co Ltd,CH,40,4020,402010,2024-05-31,2018-06-01
CNE1000007T5,002179 C2 Equity,AVIC Jonhon Optronic Technology Co Ltd,CH,45,4520,452030,2021-08-31,2019-12-01
CNE000000MH6,600760 C1 Equity,AVIC Shenyang Aircraft Co Ltd,CH,20,2010,201010,2021-08-31,2018-09-01
CNE000000RF9,000768 C2 Equity,AVIC Xi'an Aircraft Industry Group Co Ltd,CH,20,2010,201010,2021-08-31,2018-06-01
CNE0000015V6,600038 C1 Equity,AVICOPTER PLC,CH,20,2010,201010,2024-05-31,2019-12-01
CNE100000F87,002281 C2 Equity,Accelink Technologies Co Ltd,CH,45,4520,452030,2024-05-31,2019-12-01
CNE000000DM5,000547 C2 Equity,Addsino Co Ltd,CH,45,4520,452010,2022-05-31,2020-06-01
CNE100003MM9,688012 C1 Equity,Advanced Micro-Fabrication Equipment Inc China,CH,45,4530,453010,2024-05-31,2021-09-01
KYG011981035,3383 HK Equity,Agile Group Holdings Ltd,CH,60,6020,602010,2022-05-31,2014-03-01
US00851L1035,API UW Equity,Agora Inc,CH,45,4510,451030,2022-02-28,2021-06-01
CNE100000Q43,1288 HK Equity,Agricultural Bank of China Ltd,CH,40,4010,401010,2024-05-31,2014-03-01
CNE100000RJ0,601288 C1 Equity,Agricultural Bank of China Ltd,CH,40,4010,401010,2024-05-31,2018-06-01
CNE100000GR6,300015 C2 Equity,Aier Eye Hospital Group Co Ltd,CH,35,3510,351020,2024-05-31,2019-06-01
CNE000001NN0,601111 C1 Equity,Air China Ltd,CH,20,2030,203020,2024-05-31,2018-06-01
CNE1000001S0,753 HK Equity,Air China Ltd,CH,20,2030,203020,2024-05-31,2014-03-01
CNE000001FB1,600271 C1 Equity,Aisino Corp,CH,45,4510,451030,2020-11-30,2018-06-01
KYG0146B1032,9926 HK Equity,Akeso Inc,CH,35,3520,352010,2024-05-31,2021-06-01
US01609W1027,BABA UN Equity,Alibaba Group Holding Ltd,CH,25,2550,255030,2021-05-31,2015-12-01
KYG017191142,9988 HK Equity,Alibaba Group Holding Ltd,CH,25,2550,255030,2024-05-31,2021-06-01
CNE1000000T0,601600 C1 Equity,Aluminum Corp of China Ltd,CH,15,1510,151040,2024-05-31,2019-03-01
CNE1000001T8,2600 HK Equity,Aluminum Corp of China Ltd,CH,15,1510,151040,2024-05-31,2014-03-01
CNE100003LZ3,688099 C1 Equity,Amlogic Shanghai Co Ltd,CH,45,4530,453010,2024-05-31,2022-06-01
CNE1000001V4,347 HK Equity,Angang Steel Co Ltd,CH,15,1510,151040,2019-11-30,2018-06-01
CNE000000SQ4,000898 C2 Equity,Angang Steel Co Ltd,CH,15,1510,151040,2020-11-30,2018-06-01
CNE0000014G0,600298 C1 Equity,Angel Yeast Co Ltd,CH,30,3020,302020,2024-05-31,2019-12-01
CNE0000019V8,600585 C1 Equity,Anhui Conch Cement Co Ltd,CH,15,1510,151020,2024-05-31,2018-06-01
CNE1000001W2,914 HK Equity,Anhui Conch Cement Co Ltd,CH,15,1510,151020,2024-05-31,2014-03-01
CNE000000K82,200596 CS Equity,Anhui Gujing Distillery Co Ltd,CH,30,3020,302010,2024-05-31,2020-06-01
CNE000000MD5,000596 C2 Equity,Anhui Gujing Distillery Co Ltd,CH,30,3020,302010,2024-05-31,2019-12-01
CNE100000Z75,002541 C2 Equity,Anhui Honglu Steel Construction Group Co Ltd,CH,15,1510,151040,2024-02-29,2021-06-01
CNE0000018M9,600418 C1 Equity,Anhui Jianghuai Automobile Group Corp Ltd,CH,25,2510,251020,2024-05-31,2023-09-01
CNE1000022S6,603589 C1 Equity,Anhui Kouzi Distillery Co Ltd,CH,30,3020,302010,2024-05-31,2019-12-01
CNE1000022H9,603198 C1 Equity,Anhui Yingjia Distillery Co Ltd,CH,30,3020,302010,2024-05-31,2021-12-01
CNE100002YQ7,603345 C1 Equity,Anjoy Foods Group Co Ltd,CH,30,3020,302020,2024-05-31,2020-12-01
CNE1000047B9,300866 C2 Equity,Anker Innovations Technology Co Ltd,CH,45,4520,452020,2024-05-31,2023-09-01
CNE000000Q45,000739 C2 Equity,Apeloa Pharmaceutical Co Ltd,CH,35,3520,352020,2024-02-29,2020-06-01
CNE000000XS0,000893 C2 Equity,Asia - Potash International Investment Guangzhou Co Ltd,CH,15,1510,151010,2024-05-31,2022-06-01
CNE100002BZ6,002821 C2 Equity,Asymchem Laboratories Tianjin Co Ltd,CH,35,3520,352020,2024-05-31,2019-12-01
CNE100003RF2,688208 C1 Equity,Autel Intelligent Technology Corp Ltd,CH,25,2510,251010,2022-05-31,2021-12-01
CNE100002GC4,603658 C1 Equity,Autobio Diagnostics Co Ltd,CH,35,3510,351010,2024-05-31,2019-12-01
US05278C1071,ATHM UN Equity,Autohome Inc,CH,50,5020,502030,2024-05-31,2017-06-01
CNE100003GF5,002938 C2 Equity,Avary Holding Shenzhen Co Ltd,CH,45,4520,452030,2024-05-31,2021-06-01
CNE1000001Y8,2357 HK Equity,AviChina Industry & Technology Co Ltd,CH,20,2010,201010,2024-05-31,2014-03-01
CNE000000GZ0,600862 C1 Equity,Avic Aviation High-Technology Co Ltd,CH,20,2010,201060,2021-08-31,2021-03-01
CNE000000LP1,600733 C1 Equity,BAIC BluePark New Energy Technology Co Ltd,CH,25,2510,251020,2024-05-31,2019-12-01
CNE100001TJ4,1958 HK Equity,BAIC Motor Corp Ltd,CH,25,2510,251020,2020-11-30,2018-06-01
CNE100000F20,2009 HK Equity,BBMG Corp,CH,15,1510,151020,2020-05-31,2014-03-01
CNE1000010M4,601992 C1 Equity,BBMG Corp,CH,15,1510,151020,2023-08-31,2018-06-01
US08653C6012,BEST UN Equity,BEST Inc,CH,20,2030,203010,2020-11-30,2019-12-01
CNE100003449,300676 C2 Equity,BGI Genomics Co Ltd,CH,35,3520,352010,2024-02-29,2019-12-01
CNE100003R64,601696 C1 Equity,BOC International China Co Ltd,CH,40,4020,402030,2024-05-31,2021-06-01
CNE0000016L5,000725 C2 Equity,BOE Technology Group Co Ltd,CH,45,4520,452030,2024-05-31,2018-06-01
CNE0000012Q3,600258 C1 Equity,BTG Hotels Group Co Ltd,CH,25,2530,253010,2024-02-29,2019-12-01
CNE100000296,1211 HK Equity,BYD Co Ltd,CH,25,2510,251020,2024-05-31,2014-03-01
CNE100001526,002594 C2 Equity,BYD Co Ltd,CH,25,2510,251020,2024-05-31,2018-06-01
HK0285041858,285 HK Equity,BYD Electronic International Co Ltd,CH,45,4520,452010,2024-05-31,2017-12-01
US0567521085,BIDU UW Equity,Baidu Inc,CH,50,5020,502030,2022-05-31,2015-12-01
KYG070341048,9888 HK Equity,Baidu Inc,CH,50,5020,502030,2024-05-31,2022-06-01
CNE100000734,601169 C1 Equity,Bank of Beijing Co Ltd,CH,40,4010,401010,2024-05-31,2018-06-01
CNE100003F50,601577 C1 Equity,Bank of Changsha Co Ltd,CH,40,4010,401010,2024-05-31,2021-12-01
CNE100002SN6,601838 C1 Equity,Bank of Chengdu Co Ltd,CH,40,4010,401010,2024-05-31,2019-06-01
CNE000001N05,601988 C1 Equity,Bank of China Ltd,CH,40,4010,401010,2024-05-31,2018-06-01
CNE1000001Z5,3988 HK Equity,Bank of China Ltd,CH,40,4010,401010,2024-05-31,2014-03-01
CNE1000000S2,601328 C1 Equity,Bank of Communications Co Ltd,CH,40,4010,401010,2024-05-31,2018-06-01
CNE100000205,3328 HK Equity,Bank of Communications Co Ltd,CH,40,4010,401010,2024-05-31,2014-03-01
CNE100002FX2,601997 C1 Equity,Bank of Guiyang Co Ltd,CH,40,4010,401010,2020-05-31,2018-06-01
CNE100002GQ4,600926 C1 Equity,Bank of Hangzhou Co Ltd,CH,40,4010,401010,2024-05-31,2018-06-01
CNE100002G76,600919 C1 Equity,Bank of Jiangsu Co Ltd,CH,40,4010,401010,2024-05-31,2018-06-01
CNE100000627,601009 C1 Equity,Bank of Nanjing Co Ltd,CH,40,4010,401010,2024-05-31,2018-06-01
CNE1000005P7,002142 C2 Equity,Bank of Ningbo Co Ltd,CH,40,4010,401010,2024-05-31,2018-06-01
CNE100002FM5,601229 C1 Equity,Bank of Shanghai Co Ltd,CH,40,4010,401010,2024-05-31,2018-06-01
CNE100003LQ2,002966 C2 Equity,Bank of Suzhou Co Ltd,CH,40,4010,401010,2024-05-31,2022-12-01
CNE0000015R4,600019 C1 Equity,Baoshan Iron & Steel Co Ltd,CH,15,1510,151040,2024-05-31,2018-06-01
US06684L1035,BZUN UW Equity,Baozun Inc,CH,25,2550,255030,2021-11-30,2018-09-01
CNE100000643,002151 C2 Equity,Beijing BDStar Navigation Co Ltd,CH,45,4520,452010,2022-05-31,2020-12-01
CNE000001782,600376 C1 Equity,Beijing Capital Development Co Ltd,CH,60,6020,602010,2020-11-30,2019-12-01
CNE000001295,600008 C1 Equity,Beijing Capital Eco-Environment Protection Group Co Ltd,CH,55,5510,551040,2019-05-31,2018-06-01
CNE100000221,694 HK Equity,Beijing Capital International Airport Co Ltd,CH,20,2030,203050,2023-11-30,2014-03-01
CNE100000N61,002385 C2 Equity,Beijing Dabeinong Technology Group Co Ltd,CH,30,3020,302020,2024-05-31,2018-06-01
CNE1000012M0,300212 C2 Equity,Beijing E-Hualu Information Technology Co Ltd,CH,45,4510,451030,2024-02-29,2020-06-01
CNE100000NN1,300073 C2 Equity,Beijing Easpring Material Technology Co Ltd,CH,20,2010,201040,2024-02-29,2021-12-01
CNE100001617,300251 C2 Equity,Beijing Enlight Media Co Ltd,CH,50,5020,502020,2024-05-31,2019-12-01
CNE100000NP6,300072 C2 Equity,Beijing Haixin Energy Technology Co Ltd,CH,15,1510,151010,2020-05-31,2019-12-01
CNE100003PM2,688111 C1 Equity,Beijing Kingsoft Office Software Inc,CH,45,4510,451030,2024-05-31,2021-09-01
CNE000000QS4,000786 C2 Equity,Beijing New Building Materials PLC,CH,20,2010,201020,2024-05-31,2019-12-01
CNE100000CS3,002271 C2 Equity,Beijing Oriental Yuhong Waterproof Technology Co Ltd,CH,15,1510,151020,2024-05-31,2019-12-01
CNE100000N95,300070 C2 Equity,Beijing Originwater Technology Co Ltd,CH,20,2020,202010,2023-02-28,2019-12-01
CNE100003R80,688169 C1 Equity,Beijing Roborock Technology Co Ltd,CH,25,2520,252010,2024-05-31,2021-09-01
CNE000001L31,002038 C2 Equity,Beijing SL Pharmaceutical Co Ltd,CH,35,3520,352010,2020-05-31,2019-12-01
CNE100000668,002153 C2 Equity,Beijing Shiji Information Technology Co Ltd,CH,45,4510,451030,2024-02-29,2018-06-01
CNE000000XH3,000860 C2 Equity,Beijing Shunxin Agriculture Co Ltd,CH,30,3020,302010,2022-11-30,2019-12-01
CNE100001S16,300383 C2 Equity,Beijing Sinnet Technology Co Ltd,CH,45,4510,451020,2022-11-30,2019-12-01
CNE000001QM5,300271 C2 Equity,Beijing Thunisoft Corp Ltd,CH,45,4510,451030,2021-05-31,2020-06-01
CNE000000WF9,600161 C1 Equity,Beijing Tiantan Biological Products Corp Ltd,CH,35,3520,352010,2024-05-31,2019-12-01
CNE000000R69,600085 C1 Equity,Beijing Tongrentang Co Ltd,CH,35,3520,352020,2024-05-31,2018-06-01
CNE100003M28,603613 C1 Equity,Beijing United Information Technology Co Ltd,CH,20,2010,201070,2024-02-29,2021-06-01
CNE100004090,603392 C1 Equity,Beijing Wantai Biological Pharmacy Enterprise Co Ltd,CH,35,3520,352010,2024-05-31,2021-09-01
CNE000000S84,000729 C2 Equity,Beijing Yanjing Brewery Co Ltd,CH,30,3020,302010,2024-05-31,2019-12-01
CNE100003LG3,603267 C1 Equity,Beijing Yuanliu Hongyuan Electronic Technology Co Ltd,CH,45,4520,452030,2023-05-31,2021-06-01
CNE100003RV9,601816 C1 Equity,Beijing-Shanghai High Speed Railway Co Ltd,CH,20,2030,203040,2024-05-31,2020-09-01
CNE000000WC6,600166 C1 Equity,Beiqi Foton Motor Co Ltd,CH,25,2510,251020,2024-05-31,2023-09-01
KYG097021045,2129452D HK Equity,Belle International Holdings Ltd,CH,25,2520,252030,2017-08-31,2014-03-01
CNE1000030Y7,603596 C1 Equity,Bethel Automotive Safety Systems Co Ltd,CH,25,2510,251010,2024-05-31,2022-12-01
CNE100002DD9,300558 C2 Equity,Betta Pharmaceuticals Co Ltd,CH,35,3520,352020,2024-02-29,2019-12-01
US0900401060,BILI UW Equity,Bilibili Inc,CH,50,5020,502020,2022-05-31,2020-06-01
KYG1098A1013,9626 HK Equity,Bilibili Inc,CH,50,5020,502020,2024-05-31,2022-06-01
CNE100003NL9,688363 C1 Equity,Bloomage Biotechnology Corp Ltd,CH,35,3520,352010,2024-05-31,2022-06-01
CNE0000009B1,000415 C2 Equity,Bohai Leasing Co Ltd,CH,20,2010,201070,2020-11-30,2019-12-01
US12233L1070,BNR UQ Equity,Burning Rock Biotech Ltd,CH,35,3520,352010,2021-11-30,2021-06-01
CNE100000Y84,300146 C2 Equity,By-health Co Ltd,CH,30,3030,303020,2024-05-31,2019-12-01
CNE100000X36,002511 C2 Equity,C&S Paper Co Ltd,CH,30,3030,303010,2022-05-31,2020-06-01
CNE0000000K1,000591 C2 Equity,CECEP Solar Energy Co Ltd,CH,55,5510,551050,2024-05-31,2021-12-01
CNE100001T15,601016 C1 Equity,CECEP Wind-Power Corp,CH,55,5510,551050,2024-02-29,2021-12-01
CNE100000CM6,002268 C2 Equity,CETC Cyberspace Security Technology Co Ltd,CH,45,4510,451030,2024-02-29,2019-12-01
CNE100001T80,1816 HK Equity,CGN Power Co Ltd,CH,55,5510,551050,2024-05-31,2014-12-01
CNE100003N43,003816 C2 Equity,CGN Power Co Ltd,CH,55,5510,551050,2024-05-31,2023-12-01
KYG2140A1076,884 HK Equity,CIFI Holdings Group Co Ltd,CH,60,6020,602010,2022-11-30,2018-03-01
CNE000000TD0,000839 C2 Equity,CITIC Guoan Information Industry Co Ltd,CH,50,5020,502010,2020-05-31,2018-06-01
HK0267001375,267 HK Equity,CITIC Ltd,CH,20,2010,201050,2024-05-31,2014-03-01
CNE000001DB6,600030 C1 Equity,CITIC Securities Co Ltd,CH,40,4020,402030,2024-05-31,2018-06-01
CNE1000016V2,6030 HK Equity,CITIC Securities Co Ltd,CH,40,4020,402030,2024-05-31,2014-03-01
CNE100000114,3993 HK Equity,CMOC Group Ltd,CH,15,1510,151040,2024-05-31,2017-12-01
CNE100001NR0,603993 C1 Equity,CMOC Group Ltd,CH,15,1510,151040,2024-05-31,2018-06-01
CNE1000049X9,300919 C2 Equity,CNGR Advanced Material Co Ltd,CH,15,1510,151010,2024-05-31,2022-03-01
CNE1000005X1,002145 C2 Equity,CNNC Hua Yuan Titanium Dioxide Co Ltd,CH,15,1510,151010,2023-11-30,2021-12-01
HK0883013259,883 HK Equity,CNOOC Ltd,CH,10,1010,101020,2021-02-28,2014-03-01
CNE000000MS3,000617 C2 Equity,CNPC Capital Co Ltd,CH,40,4010,401010,2024-05-31,2023-09-01
CNE100000536,2866 HK Equity,COSCO SHIPPING Development Co Ltd,CH,20,2010,201070,2018-11-30,2014-03-01
CNE1000008F2,601866 C1 Equity,COSCO SHIPPING Development Co Ltd,CH,20,2010,201070,2024-05-31,2018-06-01
CNE000001BD6,600026 C1 Equity,COSCO SHIPPING Energy Transportation Co Ltd,CH,10,1010,101020,2024-05-31,2019-12-01
CNE1000002S8,1138 HK Equity,COSCO SHIPPING Energy Transportation Co Ltd,CH,10,1010,101020,2024-05-31,2018-06-01
CNE1000002J7,1919 HK Equity,COSCO SHIPPING Holdings Co Ltd,CH,20,2030,203030,2024-05-31,2014-03-01
CNE100000601,601919 C1 Equity,COSCO SHIPPING Holdings Co Ltd,CH,20,2030,203030,2024-05-31,2018-06-01
CNE100000BG0,1766 HK Equity,CRRC Corp Ltd,CH,20,2010,201060,2024-05-31,2014-03-01
CNE100000CP9,601766 C1 Equity,CRRC Corp Ltd,CH,20,2010,201060,2024-05-31,2018-06-01
CNE1000031T5,601066 C1 Equity,CSC Financial Co Ltd,CH,40,4020,402030,2024-05-31,2019-12-01
CNE100003K04,300765 C2 Equity,CSPC Innovation Pharmaceutical Co Ltd,CH,35,3520,352020,2024-05-31,2023-12-01
HK1093012172,1093 HK Equity,CSPC Pharmaceutical Group Ltd,CH,35,3520,352020,2024-05-31,2014-03-01
CNE000000QR6,600072 C1 Equity,CSSC Science & Technology Co Ltd,CH,20,2010,201030,2024-05-31,2023-12-01
CNE100002V44,601108 C1 Equity,Caitong Securities Co Ltd,CH,40,4020,402030,2024-05-31,2019-06-01
CNE1000041R8,688256 C1 Equity,Cambricon Technologies Corp Ltd,CH,45,4530,453010,2024-05-31,2023-06-01
CNE100003F01,6185 HK Equity,CanSino Biologics Inc,CH,35,3520,352010,2022-11-30,2020-06-01
CNE100004BM0,688185 C1 Equity,CanSino Biologics Inc,CH,35,3520,352010,2022-11-30,2021-06-01
CNE100001XM0,300390 C2 Equity,Canmax Technologies Co Ltd,CH,15,1510,151010,2024-05-31,2021-12-01
CNE100004447,688065 C1 Equity,Cathay Biotech Inc,CH,15,1510,151010,2024-05-31,2023-12-01
CNE100000GV8,300012 C2 Equity,Centre Testing International Group Co Ltd,CH,20,2020,202020,2021-02-28,2019-12-01
CNE1000010Q5,002557 C2 Equity,Chacha Food Co Ltd,CH,30,3020,302020,2023-02-28,2020-06-01
CNE0000007J8,000661 C2 Equity,Changchun High-Tech Industry Group Co Ltd,CH,35,3520,352020,2024-05-31,2019-12-01
CNE000000SH3,000783 C2 Equity,Changjiang Securities Co Ltd,CH,40,4020,402030,2024-05-31,2018-06-01
CNE1000011H2,601799 C1 Equity,Changzhou Xingyu Automotive Lighting Systems Co Ltd,CH,25,2510,251010,2024-05-31,2019-12-01
CNE100001Y42,300408 C2 Equity,Chaozhou Three-Circle Group Co Ltd,CH,45,4520,452030,2024-05-31,2019-06-01
CNE1000020C4,002773 C2 Equity,Chengdu Kanghong Pharmaceutical Group Co Ltd,CH,35,3520,352020,2021-05-31,2019-12-01
CNE000000HN4,000598 C2 Equity,Chengdu Xingrong Environment Co Ltd,CH,55,5510,551040,2020-11-30,2019-12-01
CNE000000KN8,600711 C1 Equity,Chengtun Mining Group Co Ltd,CH,15,1510,151040,2023-05-31,2021-12-01
CNE100000BN6,002240 C2 Equity,Chengxin Lithium Group Co Ltd,CH,15,1510,151010,2024-05-31,2021-12-01
CNE000001H94,600988 C1 Equity,Chifeng Jilong Gold Mining Co Ltd,CH,15,1510,151040,2024-05-31,2020-12-01
CNE000000J93,600879 C1 Equity,China Aerospace Times Electronics Co Ltd,CH,20,2010,201010,2021-08-31,2019-12-01
KYG2119Z1090,3883 HK Equity,China Aoyuan Group Ltd,CH,60,6020,602010,2021-11-30,2019-06-01
CNE000000222,000009 C2 Equity,China Baoan Group Co Ltd,CH,20,2010,201050,2024-05-31,2021-09-01
CNE1000002D0,3983 HK Equity,China BlueChemical Ltd,CH,15,1510,151010,2014-11-30,2014-03-01
CNE100003YB7,9668 HK Equity,China Bohai Bank Co Ltd,CH,40,4010,401010,2022-05-31,2020-12-01
CNE1000000R4,601998 C1 Equity,China CITIC Bank Corp Ltd,CH,40,4010,401010,2020-11-30,2018-06-01
CNE1000001Q4,998 HK Equity,China CITIC Bank Corp Ltd,CH,40,4010,401010,2024-05-31,2014-03-01
CNE100002367,2799 HK Equity,China CITIC Financial Asset Management Co Ltd,CH,40,4020,402030,2021-05-31,2016-12-01
CNE100001SC1,1773005D HK Equity,China CNR Corp Ltd,CH,20,2010,201060,2015-05-31,2015-03-01
CNE000000W05,600150 C1 Equity,China CSSC Holdings Ltd,CH,20,2010,201060,2024-05-31,2021-06-01
CNE100001QS1,1359 HK Equity,China Cinda Asset Management Co Ltd,CH,40,4020,402030,2024-05-31,2014-03-01
CNE100000528,1898 HK Equity,China Coal Energy Co Ltd,CH,10,1010,101020,2024-05-31,2014-03-01
CNE1000002F5,1800 HK Equity,China Communications Construction Co Ltd,CH,20,2010,201030,2021-02-28,2014-03-01
CNE100001FN5,601800 C1 Equity,China Communications Construction Co Ltd,CH,20,2010,201030,2021-02-28,2018-06-01
CNE1000002G3,552 HK Equity,China Communications Services Corp Ltd,CH,20,2010,201030,2024-05-31,2014-03-01
KYG2116J1085,586 HK Equity,China Conch Venture Holdings Ltd,CH,20,2010,201030,2023-11-30,2015-06-01
CNE1000002H1,939 HK Equity,China Construction Bank Corp,CH,40,4010,401010,2024-05-31,2014-03-01
CNE100000742,601939 C1 Equity,China Construction Bank Corp,CH,40,4010,401010,2024-05-31,2018-06-01
KYG2120T1004,667 HK Equity,China East Education Holdings Ltd,CH,25,2530,253020,2021-11-30,2019-12-01
CNE1000002K5,670 HK Equity,China Eastern Airlines Corp Ltd,CH,20,2030,203020,2020-11-30,2018-06-01
CNE000000TR0,600115 C1 Equity,China Eastern Airlines Corp Ltd,CH,20,2030,203020,2024-05-31,2018-06-01
CNE100004QL0,601868 C1 Equity,China Energy Engineering Corp Ltd,CH,20,2010,201030,2024-05-31,2022-03-01
CNE000000B42,600675 C1 Equity,China Enterprise Co Ltd,CH,60,6020,602010,2020-11-30,2019-12-01
CNE100000SL4,601818 C1 Equity,China Everbright Bank Co Ltd,CH,40,4010,401010,2024-05-31,2018-06-01
CNE100001QW3,6818 HK Equity,China Everbright Bank Co Ltd,CH,40,4010,401010,2024-05-31,2014-06-01
KYG2119W1069,3333 HK Equity,China Evergrande Group,CH,60,6020,602010,2022-05-31,2014-03-01
KYG2121Q1055,6186 HK Equity,China Feihe Ltd,CH,30,3020,302020,2024-05-31,2020-06-01
CNE100002GX0,600977 C1 Equity,China Film Co Ltd,CH,50,5020,502020,2024-05-31,2018-06-01
CNE000001GG8,600340 C1 Equity,China Fortune Land Development Co Ltd,CH,60,6020,602010,2021-11-30,2018-06-01
CNE100001NT6,6881 HK Equity,China Galaxy Securities Co Ltd,CH,40,4020,402030,2024-05-31,2014-12-01
CNE100002FG7,601881 C1 Equity,China Galaxy Securities Co Ltd,CH,40,4020,402030,2024-05-31,2020-06-01
CNE000000QF1,600068 C1 Equity,China Gezhouba Group Co Ltd,CH,20,2010,201030,2021-05-31,2018-06-01
CNE000001576,600297 C1 Equity,China Grand Automotive Services Group Co Ltd,CH,25,2550,255040,2020-05-31,2018-06-01
CNE100003GD0,002939 C2 Equity,China Great Wall Securities Co Ltd,CH,40,4020,402030,2024-05-31,2020-06-01
CNE000000RL7,000066 C2 Equity,China Greatwall Technology Group Co Ltd,CH,45,4520,452020,2024-05-31,2019-12-01
KYG211501005,1378 HK Equity,China Hongqiao Group Ltd,CH,15,1510,151040,2024-05-31,2018-12-01
KYG2117A1067,6863 HK Equity,China Huishan Dairy Holdings Co Ltd,CH,30,3020,302020,2017-08-31,2014-06-01
CNE100002359,3908 HK Equity,China International Capital Corp Ltd,CH,40,4020,402030,2024-05-31,2018-06-01
CNE1000048J0,601995 C1 Equity,China International Capital Corp Ltd,CH,40,4020,402030,2024-05-31,2021-03-01
CNE100001NN9,2039 HK Equity,China International Marine Containers Group Co Ltd,CH,20,2010,201060,2018-11-30,2014-03-01
CNE000000644,000039 C2 Equity,China International Marine Containers Group Co Ltd,CH,20,2010,201060,2020-05-31,2018-06-01
CNE000000YM1,600176 C1 Equity,China Jushi Co Ltd,CH,15,1510,151020,2024-05-31,2019-12-01
KYG2157Q1029,2128 HK Equity,China Lesso Group Holdings Ltd,CH,20,2010,201020,2023-08-31,2019-12-01
CNE000001Q93,601628 C1 Equity,China Life Insurance Co Ltd,CH,40,4030,403010,2024-05-31,2018-06-01
CNE1000002L3,2628 HK Equity,China Life Insurance Co Ltd,CH,40,4030,403010,2024-05-31,2014-03-01
KYG2121R1039,772 HK Equity,China Literature Ltd,CH,50,5020,502010,2024-05-31,2018-06-01
CNE100000HD4,916 HK Equity,China Longyuan Power Group Corp Ltd,CH,55,5510,551050,2024-05-31,2014-03-01
CNE000000Q29,600056 C1 Equity,China Meheco Co Ltd,CH,35,3510,351020,2024-02-29,2019-12-01
KYG211921021,1268 HK Equity,China Meidong Auto Holdings Ltd,CH,25,2550,255040,2023-11-30,2020-12-01
KYG210961051,2319 HK Equity,China Mengniu Dairy Co Ltd,CH,30,3020,302020,2024-05-31,2014-03-01
CNE000001B33,600036 C1 Equity,China Merchants Bank Co Ltd,CH,40,4010,401010,2024-05-31,2018-06-01
CNE1000002M1,3968 HK Equity,China Merchants Bank Co Ltd,CH,40,4010,401010,2024-05-31,2014-03-01
CNE000001PQ8,601872 C1 Equity,China Merchants Energy Shipping Co Ltd,CH,10,1010,101020,2024-05-31,2019-12-01
CNE1000032B1,001965 C2 Equity,China Merchants Expressway Network & Technology Holdings Co Ltd,CH,20,2030,203050,2024-05-31,2024-03-01
CNE000000H95,001914 C2 Equity,China Merchants Property Operation & Service Co Ltd,CH,60,6020,602010,2021-11-30,2020-06-01
CNE100000HK9,600999 C1 Equity,China Merchants Securities Co Ltd,CH,40,4020,402030,2024-05-31,2018-06-01
CNE100002FC6,001979 C2 Equity,China Merchants Shekou Industrial Zone Holdings Co Ltd,CH,60,6020,602010,2024-05-31,2018-06-01
CNE0000015Y0,600016 C1 Equity,China Minsheng Banking Corp Ltd,CH,40,4010,401010,2024-05-31,2018-06-01
CNE100000HF9,1988 HK Equity,China Minsheng Banking Corp Ltd,CH,40,4010,401010,2024-05-31,2014-03-01
CNE0000009N6,000028 C2 Equity,China National Accord Medicines Corp Ltd,CH,35,3510,351020,2021-05-31,2019-12-01
CNE1000002N9,3323 HK Equity,China National Building Material Co Ltd,CH,15,1510,151020,2024-05-31,2014-03-01
CNE100000KC0,601117 C1 Equity,China National Chemical Engineering Co Ltd,CH,20,2010,201030,2024-05-31,2018-06-01
CNE000001D56,600511 C1 Equity,China National Medicines Corp Ltd,CH,35,3510,351020,2024-05-31,2019-12-01
CNE1000022N7,601985 C1 Equity,China National Nuclear Power Co Ltd,CH,55,5510,551050,2024-05-31,2018-06-01
CNE000001BB0,600536 C1 Equity,China National Software & Service Co Ltd,CH,45,4510,451030,2024-05-31,2019-12-01
CNE000000T18,600111 C1 Equity,China Northern Rare Earth Group High-Tech Co Ltd,CH,15,1510,151040,2024-05-31,2018-06-01
CNE100002896,601611 C1 Equity,China Nuclear Engineering & Construction Corp Ltd,CH,20,2010,201030,2018-11-30,2018-06-01
CNE1000002P4,2883 HK Equity,China Oilfield Services Ltd,CH,10,1010,101010,2024-05-31,2014-03-01
BMG2108V1019,581 HK Equity,China Oriental Group Co Ltd,CH,15,1510,151040,2019-11-30,2018-12-01
CNE1000008M8,601601 C1 Equity,China Pacific Insurance Group Co Ltd,CH,40,4030,403010,2024-05-31,2018-06-01
CNE1000009Q7,2601 HK Equity,China Pacific Insurance Group Co Ltd,CH,40,4030,403010,2024-05-31,2014-03-01
CNE0000018G1,600028 C1 Equity,China Petroleum & Chemical Corp,CH,10,1010,101020,2024-05-31,2018-06-01
CNE1000002Q2,386 HK Equity,China Petroleum & Chemical Corp,CH,10,1010,101020,2024-05-31,2014-03-01
CNE100000981,1186 HK Equity,China Railway Construction Corp Ltd,CH,20,2010,201030,2021-02-28,2014-03-01
CNE1000009T1,601186 C1 Equity,China Railway Construction Corp Ltd,CH,20,2010,201030,2021-02-28,2018-06-01
CNE1000007Z2,390 HK Equity,China Railway Group Ltd,CH,20,2010,201030,2024-05-31,2014-03-01
CNE100000866,601390 C1 Equity,China Railway Group Ltd,CH,20,2010,201030,2024-05-31,2019-09-01
CNE0000017Z3,600528 C1 Equity,China Railway Hi-tech Industry Co Ltd,CH,20,2010,201030,2020-05-31,2019-12-01
CNE1000021L3,3969 HK Equity,China Railway Signal & Communication Corp Ltd,CH,45,4520,452030,2020-11-30,2018-06-01
CNE100003MP2,688009 C1 Equity,China Railway Signal & Communication Corp Ltd,CH,45,4520,452030,2024-05-31,2021-06-01
CNE000000WS2,000831 C2 Equity,China Rare Earth Resources And Technology Co Ltd,CH,15,1510,151040,2024-05-31,2021-12-01
CNE100002342,1508 HK Equity,China Reinsurance Group Corp,CH,40,4030,403010,2020-11-30,2018-06-01
CNE000000Q94,600062 C1 Equity,China Resources Double Crane Pharmaceutical Co Ltd,CH,35,3520,352020,2020-05-31,2019-12-01
CNE100003S06,688396 C1 Equity,China Resources Microelectronics Ltd,CH,45,4530,453010,2024-05-31,2022-03-01
KYG2122G1064,1209 HK Equity,China Resources Mixc Lifestyle Services Ltd,CH,60,6020,602010,2024-05-31,2021-06-01
HK0000311099,3320 HK Equity,China Resources Pharmaceutical Group Ltd,CH,35,3520,352020,2024-05-31,2017-12-01
